{
  "$schema": "http://json-schema.org/draft-07/schema#",
  "title": "Research Methodology Record",
  "description": "Schema for a single methodology record in the synthetic UX research methodology database. One file per methodology in the methodologies/ folder. File named by methodology_id.",
  "type": "object",
  "required": ["_meta", "description", "eval_metrics", "eval_schema", "planner_guidance", "report_sections"],
  "properties": {
    "_meta": {
      "type": "object",
      "required": ["methodology_id", "display_name", "version", "compatible_with_synthetic_personas", "runner_type"],
      "properties": {
        "methodology_id":                    { "type": "string", "description": "Snake_case identifier used as the database lookup key" },
        "display_name":                      { "type": "string", "description": "Human-readable label shown in the UI" },
        "version":                           { "type": "string" },
        "compatible_with_synthetic_personas":{ "type": "boolean" },
        "runner_type": {
          "type": "string",
          "enum": ["task_based", "reaction_based", "impression_based", "custom"],
          "description": "task_based: turn-by-turn navigation. reaction_based: one or two turn concept evaluation. impression_based: single-turn emotional/aesthetic response."
        }
      }
    },
    "description": { "type": "string", "description": "What this methodology is and when to use it" },
    "eval_metrics": {
      "type": "array",
      "minItems": 1,
      "items": {
        "type": "object",
        "required": ["key", "type", "description"],
        "properties": {
          "key":         { "type": "string" },
          "type":        { "type": "string", "enum": ["binary", "numeric_0_10", "qualitative", "categorical"] },
          "description": { "type": "string" }
        }
      }
    },
    "eval_schema": {
      "type": "object",
      "required": ["fields", "persona_instructions"],
      "properties": {
        "fields":               { "type": "array", "items": { "type": "string" }, "description": "JSON fields the evaluator expects in each persona turn response" },
        "persona_instructions": { "type": "string", "description": "Appended to the persona system prompt to explain what to return each turn" }
      }
    },
    "planner_guidance": { "type": "string", "description": "Instruction string passed to the research planner agent to guide plan generation for this methodology" },
    "report_sections": {
      "type": "object",
      "required": ["section_03_label", "section_03_content", "section_04_label", "section_04_content", "hypothesis_focus"],
      "properties": {
        "section_03_label":   { "type": "string", "description": "Label for the Methodology section in the report" },
        "section_03_content": { "type": "array", "items": { "type": "string" }, "description": "Ordered list of content blocks to render in section 03" },
        "section_04_label":   { "type": "string", "description": "Label for the Key Findings section in the report" },
        "section_04_content": { "type": "array", "items": { "type": "string" }, "description": "Ordered list of content blocks to render in section 04" },
        "hypothesis_focus":   { "type": "string", "description": "What hypotheses for this methodology should test" }
      }
    }
  }
}
