{
  "_meta": {
    "methodology_id": "concept_testing",
    "display_name": "Concept Testing",
    "version": "v1.0",
    "compatible_with_synthetic_personas": true,
    "runner_type": "reaction_based"
  },
  "description": "Personas are shown a concept, idea, or early design and asked to evaluate it in one or two turns. No navigation required — the persona reads, reacts, and reports. Best for validating ideas before they are built or before committing to a direction.",
  "eval_metrics": [
    { "key": "comprehension_rate",   "type": "binary",       "description": "Did the persona understand the concept without prompting?" },
    { "key": "appeal_rating",        "type": "numeric_0_10", "description": "How appealing is this concept to this persona?" },
    { "key": "preference_signal",    "type": "qualitative",  "description": "What specifically did the persona prefer or reject?" },
    { "key": "confusion_signal",     "type": "qualitative",  "description": "What was misunderstood or misread about the concept?" },
    { "key": "adoption_likelihood",  "type": "categorical",  "description": "Would this persona use or buy this if it were real? (likely / unlikely / unsure)" }
  ],
  "eval_schema": {
    "fields": [
      "inner_monologue",
      "comprehension_rate",
      "appeal_rating",
      "preference_signal",
      "confusion_signal",
      "adoption_likelihood",
      "persona_alignment_note"
    ],
    "persona_instructions": "You are shown a concept. Do not navigate — simply read and react as this persona would. Report: your honest first impression in your inner monologue, whether you understood what this concept is (true/false), your appeal rating (0-10), what you liked or disliked, what was confusing, and your adoption likelihood (likely / unlikely / unsure)."
  },
  "planner_guidance": "There are no navigation tasks. Each scenario presents a concept and asks the persona to react. Focus the plan on defining what successful comprehension looks like and what the persona's honest adoption likelihood would be. The primary metric is comprehension rate and appeal rating. Hypotheses should test whether the concept is self-explanatory and appealing to the target segment.",
  "report_sections": {
    "section_03_label": "Methodology",
    "section_03_content": [
      "method_description",
      "concepts_presented",
      "reaction_format",
      "hypotheses"
    ],
    "section_04_label": "Key Findings — Concept Appeal & Comprehension",
    "section_04_content": [
      "comprehension_map",
      "appeal_rating_map",
      "adoption_likelihood_breakdown",
      "preference_signals",
      "confusion_signals"
    ],
    "hypothesis_focus": "Test whether the concept is self-explanatory and whether its appeal and adoption likelihood match the target persona profile."
  }
}
