{
  "_meta": {
    "methodology_id": "usability_testing",
    "display_name": "Usability Testing",
    "version": "v1.0",
    "compatible_with_synthetic_personas": true,
    "runner_type": "task_based"
  },
  "description": "Synthetic personas attempt defined tasks on a UI, scored turn by turn on friction, confusion, and task completion. Best for identifying where users get stuck, abandon, or succeed in completing a specific flow.",
  "eval_metrics": [
    { "key": "task_completion",   "type": "binary",        "description": "Did the persona reach the defined success condition?" },
    { "key": "friction_score",    "type": "numeric_0_10",  "description": "Aggregate friction signals per turn (0 = completely smooth, 10 = fully blocked)" },
    { "key": "confusion_signal",  "type": "qualitative",   "description": "Moments of stated uncertainty or misdirected action" },
    { "key": "trust_signal",      "type": "qualitative",   "description": "Expressions of trust or distrust toward the product or process" },
    { "key": "abandon_trigger",   "type": "categorical",   "description": "What caused the persona to exit the task early" },
    { "key": "persona_alignment", "type": "qualitative",   "description": "How well persona behaviour reflects the defined persona traits" }
  ],
  "eval_schema": {
    "fields": [
      "action",
      "screen_or_step",
      "inner_monologue",
      "friction_score",
      "confusion_signal",
      "trust_signal",
      "task_completion",
      "abandon_trigger",
      "persona_alignment_note"
    ],
    "persona_instructions": "At each turn, navigate the UI as this persona would. Report: what action you take, which screen or element you are on, your inner monologue, friction score (0-10), any confusion or trust signal, and whether the task is in_progress / completed / abandoned. If abandoned, state the trigger."
  },
  "planner_guidance": "Focus the plan on task completion and friction identification. Define a clear success condition and abandon condition for every task. Identify the exact UI steps where drop-off is most likely. The primary metric is task completion rate. Hypotheses should predict where friction will occur and why.",
  "report_sections": {
    "section_03_label": "Methodology",
    "section_03_content": [
      "method_description",
      "session_config",
      "tasks_run",
      "success_abandon_conditions",
      "hypotheses"
    ],
    "section_04_label": "Key Findings — Friction & Task Completion",
    "section_04_content": [
      "friction_map",
      "task_completion_rates",
      "confusion_signals",
      "trust_signals",
      "abandon_triggers"
    ],
    "hypothesis_focus": "Predict where friction will occur in the task flow and whether the design enables task completion without external assistance."
  }
}
